{
  "schema_version": "0.2",
  "video": {
    "title": "条形图读分类数值",
    "width": 1920,
    "height": 1080,
    "fps": 30,
    "duration_ms": 19467
  },
  "source": {
    "language": "zh-CN",
    "original_text": "主题：用条形图阅读分类数值。\n事实材料：本例全部数值都是虚构演示数据。蓝色纸飞机飞行距离为 2 米，黄色纸飞机为 4 米，红色纸飞机为 6 米。数值只用于演示如何比较三个类别，不代表真实比赛、测量或现实统计。条形图从零开始，柱子高度应与对应数值成比例。\n表达边界：明确说这是虚构演示数据；类别、数值和单位必须一致，不添加真实统计或其他测量结果。画面使用从零开始的条形图，显示蓝色、黄色、红色三类及 2、4、6 米。",
    "text_sha256": "181ad3b746a48ccffcc457d0cc9df2776f741283057a185a78dceb226e1dad73"
  },
  "style": {
    "preset": "minimal_dark",
    "seed": 20261013
  },
  "assets": [
    {
      "id": "communication_voice",
      "type": "audio",
      "path": "assets/communications_noise.wav",
      "origin": "local Kokoro-82M v1.0 Chinese TTS from model-generated NarrationPlan",
      "sha256": "211662247f0b096c5c6e1ac15d3f0992bbda8f0e3119ef4bb9921cf98b066592"
    }
  ],
  "narration": {
    "text": "这是一张从零开始的条形图。图上分蓝、黄、红三类纸飞机。演示数值依次是二米、四米和六米。柱子越高，对应的数值就越大。请记住，这些数字都是虚构演示数据。它们只用来演示如何比较三个类别。",
    "audio_asset_id": "communication_voice",
    "segments": [
      {
        "id": "n1",
        "text": "这是一张从零开始的条形图。",
        "start_ms": 257,
        "end_ms": 2635
      },
      {
        "id": "n2",
        "text": "图上分蓝、黄、红三类纸飞机。",
        "start_ms": 3191,
        "end_ms": 5722
      },
      {
        "id": "n3",
        "text": "演示数值依次是二米、四米和六米。",
        "start_ms": 6281,
        "end_ms": 9065
      },
      {
        "id": "n4",
        "text": "柱子越高，对应的数值就越大。",
        "start_ms": 9632,
        "end_ms": 11974
      },
      {
        "id": "n5",
        "text": "请记住，这些数字都是虚构演示数据。",
        "start_ms": 12533,
        "end_ms": 15857
      },
      {
        "id": "n6",
        "text": "它们只用来演示如何比较三个类别。",
        "start_ms": 16419,
        "end_ms": 19257
      }
    ],
    "alignment": {
      "method": "provider",
      "granularity": "phrase"
    }
  },
  "scenes": [
    {
      "id": "opening",
      "start_ms": 0,
      "duration_ms": 2913,
      "component": "title_card",
      "props": {
        "title": "条形图读分类数值",
        "subtitle": "从零开始比较三类纸飞机"
      },
      "narration_segment_ids": [
        "n1"
      ],
      "purpose": "点明主题：用零基条形图比较三类演示数值",
      "visual_intent": {
        "viewer_understands": "本图用零基条形图比较三类数值",
        "before": "画面空白",
        "after": "显示标题与副标题"
      },
      "beats": [
        {
          "id": "show_title",
          "action": "reveal",
          "target_id": "scene",
          "trigger": {
            "segment_id": "n1",
            "boundary": "start",
            "offset_ms": 0
          }
        }
      ]
    },
    {
      "id": "demo_chart",
      "start_ms": 2913,
      "duration_ms": 13225,
      "component": "bar_chart",
      "props": {
        "categories": [
          "蓝色纸飞机",
          "黄色纸飞机",
          "红色纸飞机"
        ],
        "values": [
          2,
          4,
          6
        ],
        "unit": "米",
        "baseline_zero": true
      },
      "narration_segment_ids": [
        "n2",
        "n3",
        "n4",
        "n5"
      ],
      "purpose": "展示三类演示数值与零基柱高关系",
      "visual_intent": {
        "viewer_understands": "三类演示数值与柱高成比例",
        "before": "尚未显示条形图",
        "after": "显示蓝2米黄4米红6米"
      },
      "beats": [
        {
          "id": "show_chart",
          "action": "reveal",
          "target_id": "scene",
          "trigger": {
            "segment_id": "n2",
            "boundary": "start",
            "offset_ms": 0
          }
        },
        {
          "id": "highlight_blue",
          "action": "highlight",
          "target_id": "bar:0",
          "trigger": {
            "segment_id": "n3",
            "boundary": "start",
            "offset_ms": 0
          }
        },
        {
          "id": "highlight_red",
          "action": "highlight",
          "target_id": "bar:2",
          "trigger": {
            "segment_id": "n4",
            "boundary": "start",
            "offset_ms": 0
          }
        }
      ]
    },
    {
      "id": "closing",
      "start_ms": 16138,
      "duration_ms": 3329,
      "component": "title_card",
      "props": {
        "title": "虚构演示数据",
        "subtitle": "仅用于演示如何比较三个类别"
      },
      "narration_segment_ids": [
        "n6"
      ],
      "purpose": "提醒这些数值仅用于演示比较类别",
      "visual_intent": {
        "viewer_understands": "这些数字仅用于演示比较类别",
        "before": "画面空白",
        "after": "显示虚构演示提示"
      },
      "beats": [
        {
          "id": "show_disclaimer",
          "action": "reveal",
          "target_id": "scene",
          "trigger": {
            "segment_id": "n6",
            "boundary": "start",
            "offset_ms": 0
          }
        }
      ]
    }
  ],
  "audio_mix": {
    "narration_gain_db": 0
  }
}
